{
  "$schema": "https://json-schema.org/draft/2020-12/schema",
  "title": "Engineering Harness project",
  "type": "object",
  "properties": {
    "schema_version": {
      "const": 1
    },
    "packs": {
      "type": "array",
      "items": {
        "type": "object",
        "properties": {
          "id": {
            "type": "string",
            "pattern": "^[a-z0-9]+(?:-[a-z0-9]+)*$",
            "maxLength": 64
          },
          "version": {
            "type": "string",
            "pattern": "^[0-9]+\\.[0-9]+\\.[0-9]+$"
          },
          "digest": {
            "type": "string",
            "pattern": "^sha256:[a-f0-9]{64}$"
          },
          "config": {
            "type": "object"
          }
        },
        "required": [
          "id",
          "version",
          "digest"
        ],
        "additionalProperties": false
      }
    },
    "rules": {
      "type": "array",
      "items": {
        "type": "string",
        "minLength": 1,
        "pattern": "^(?!/)(?!.*(?:^|/)\\.\\.(?:/|$)).+$"
      },
      "uniqueItems": true
    },
    "documentation": {
      "type": "array",
      "items": {
        "type": "string",
        "minLength": 1,
        "pattern": "^(?!/)(?!.*(?:^|/)\\.\\.(?:/|$)).+$"
      },
      "uniqueItems": true
    },
    "commands": {
      "type": "object",
      "additionalProperties": {
        "type": "object",
        "properties": {
          "argv": {
            "type": "array",
            "items": {
              "type": "string",
              "minLength": 1,
              "pattern": "^[^\u0000]+$"
            },
            "minItems": 1
          },
          "cwd": {
            "type": "string",
            "minLength": 1,
            "pattern": "^(?!/)(?!.*(?:^|/)\\.\\.(?:/|$)).+$"
          },
          "timeout_seconds": {
            "type": "integer",
            "minimum": 1,
            "maximum": 86400
          }
        },
        "required": [
          "argv",
          "cwd",
          "timeout_seconds"
        ],
        "additionalProperties": false
      }
    },
    "required_checks": {
      "type": "array",
      "items": {
        "type": "string",
        "pattern": "^[a-z0-9-]+:[a-z0-9-]+$"
      },
      "uniqueItems": true
    },
    "acceptance_criteria": {
      "type": "array",
      "items": {
        "type": "string",
        "minLength": 1
      }
    }
  },
  "required": [
    "schema_version",
    "packs",
    "rules",
    "documentation",
    "commands",
    "required_checks",
    "acceptance_criteria"
  ],
  "additionalProperties": false
}
